{
  "request_id": "req-001",
  "session_id": "sess-001",
  "user_input": "search architecture baseline",
  "allowed_tools": ["tool.search", "tool.query_db"],
  "context": {
    "system": {
      "tenant_id": "tenant-demo",
      "environment": "local",
      "policy_version": "v1"
    }
  },
  "metadata": {
    "recipient": "ops-team"
  }
}
